{"$schema":"https://json-schema.org/draft/2020-12/schema","additionalProperties":false,"properties":{"as_of":{"const":"2026-10-14T00:00:00Z","type":"string"},"coverage":{"additionalProperties":false,"properties":{"completeness":{"const":"COMPLETE","type":"string"},"covered_window":{"const":"FINITE_SOURCE_ROWS","type":"string"},"empty_proof_ref":{"const":null,"type":"null"},"frontier":{"const":"C7:1","type":"string"},"requested_scope":{"const":"getSourceAnalysis","type":"string"},"requested_window":{"const":"FINITE_SOURCE_ROWS","type":"string"},"success":{"const":true,"type":"boolean"}},"required":["requested_scope","requested_window","covered_window","completeness","success","empty_proof_ref","frontier"],"type":"object"},"data":{"additionalProperties":false,"properties":{"classification_tags":{"items":false,"maxItems":3,"minItems":3,"prefixItems":[{"const":"AST_ONLY","type":"string"},{"const":"SIGNAL_RULE","type":"string"},{"const":"NO_IMPORTS","type":"string"}],"type":"array"},"duplicates":{"items":false,"maxItems":0,"minItems":0,"type":"array"},"findings":{"items":false,"maxItems":1,"minItems":1,"prefixItems":[{"additionalProperties":false,"properties":{"line_end":{"const":2,"type":"integer"},"line_start":{"const":1,"type":"integer"},"reason":{"const":"Function has only a comparison expression; static AST analysis does not execute it.","type":"string"},"rule_id":{"const":"C7_AST_NO_IMPORT_CALL","type":"string"},"severity":{"const":"INFO","type":"string"}},"required":["rule_id","severity","line_start","line_end","reason"],"type":"object"}],"type":"array"},"licence_state":{"const":"KNOWN_ALLOWLISTED","type":"string"},"original_byte_hash":{"const":"3f3b6b2f39395f0b9e6e00aed9bada7e482d0df6dbdf6cd10d1be1f2becfb2ba","type":"string"},"original_content_ref":{"additionalProperties":false,"properties":{"entity_id":{"const":"0b834a90-b07d-5f5a-a87b-891eb833d171","type":"string"},"hash_domain":{"const":"raw-bytes-sha256-v1","type":"string"},"owner":{"const":"E_RESEARCH","type":"string"},"revision_id":{"const":"d37dc26a-3c4d-5c26-8491-6673d49dee74","type":"string"},"source_hash":{"const":"3f3b6b2f39395f0b9e6e00aed9bada7e482d0df6dbdf6cd10d1be1f2becfb2ba","type":"string"}},"required":["entity_id","revision_id","owner","hash_domain","source_hash"],"type":"object"},"primary_category":{"const":"SIGNAL_RULE","type":"string"},"ref":{"additionalProperties":false,"properties":{"entity_id":{"const":"f53e72d3-6ca3-575e-bc38-9fafd530b498","type":"string"},"hash_domain":{"const":"raw-bytes-sha256-v1","type":"string"},"owner":{"const":"E_RESEARCH","type":"string"},"revision_id":{"const":"088d4986-d17b-5f94-ad52-6fd9429c50a3","type":"string"},"source_hash":{"const":"59afe7227eaf2a2fc21642210ebed0aa073929a256b5ee833d40c9e8be89a5be","type":"string"}},"required":["entity_id","revision_id","owner","hash_domain","source_hash"],"type":"object"},"request":{"additionalProperties":false,"properties":{"comparison_catalog_ref":{"additionalProperties":false,"properties":{"entity_id":{"const":"72c5e60c-47d2-51f9-a9a8-900f54136c17","type":"string"},"hash_domain":{"const":"raw-bytes-sha256-v1","type":"string"},"owner":{"const":"E_RESEARCH","type":"string"},"revision_id":{"const":"06b224b7-9af1-58fd-aae0-0ab119310535","type":"string"},"source_hash":{"const":"630fb812302005599f52a2abba34ac43dcad55b80f53c09cf7f57790e6972718","type":"string"}},"required":["entity_id","revision_id","owner","hash_domain","source_hash"],"type":"object"},"resource_budget_ref":{"additionalProperties":false,"properties":{"entity_id":{"const":"e08e9681-0950-563c-81ae-05ce210a213b","type":"string"},"hash_domain":{"const":"raw-bytes-sha256-v1","type":"string"},"owner":{"const":"E_RESEARCH","type":"string"},"revision_id":{"const":"afbcfa75-ef47-56b5-9562-2faa72db3717","type":"string"},"source_hash":{"const":"7fb1be5d0a1e1d960e72710839ec6002621c88fd76f0d88f94859fc5f8a2897a","type":"string"}},"required":["entity_id","revision_id","owner","hash_domain","source_hash"],"type":"object"},"source_ref":{"additionalProperties":false,"properties":{"entity_id":{"const":"77646167-8c99-5a14-b922-1fdde4d9ffb9","type":"string"},"hash_domain":{"const":"raw-bytes-sha256-v1","type":"string"},"owner":{"const":"E_RESEARCH","type":"string"},"revision_id":{"const":"cd278beb-0ce9-5f5c-a7fa-efcd01a5a9cc","type":"string"},"source_hash":{"const":"5a6fc28a8ad7c74a066c9b57be43e5d2c98f94c6f363cdd17f43cfce6699579a","type":"string"}},"required":["entity_id","revision_id","owner","hash_domain","source_hash"],"type":"object"},"tool_profile_ref":{"additionalProperties":false,"properties":{"entity_id":{"const":"fd6bf4e4-6965-551c-adcc-76b135526d36","type":"string"},"hash_domain":{"const":"raw-bytes-sha256-v1","type":"string"},"owner":{"const":"E_RESEARCH","type":"string"},"revision_id":{"const":"28d1665a-3c4c-53d7-9994-9190aca7b400","type":"string"},"source_hash":{"const":"6627825856533b9634c3c2a5c22d7060d0631c7d2a4482272a17329b713c4847","type":"string"}},"required":["entity_id","revision_id","owner","hash_domain","source_hash"],"type":"object"}},"required":["source_ref","tool_profile_ref","comparison_catalog_ref","resource_budget_ref"],"type":"object"},"scan_batch_id":{"const":"aae7c2f0-169e-5809-a381-d2f81ea8f1c5","type":"string"},"source_metadata_ref":{"additionalProperties":false,"properties":{"entity_id":{"const":"d4c6cba4-92a9-5f12-9681-6e5606bd537b","type":"string"},"hash_domain":{"const":"raw-bytes-sha256-v1","type":"string"},"owner":{"const":"E_RESEARCH","type":"string"},"revision_id":{"const":"f5846c54-eb3a-5cc4-a70c-5a7e726ad657","type":"string"},"source_hash":{"const":"84dabfe33ddbded4ada9e2d2aa5ba908e6276ca24d22c000d915307e2e8d9eb1","type":"string"}},"required":["entity_id","revision_id","owner","hash_domain","source_hash"],"type":"object"},"status":{"const":"ANALYZED","type":"string"},"symbols":{"items":false,"maxItems":1,"minItems":1,"prefixItems":[{"additionalProperties":false,"properties":{"dependency_names":{"items":false,"maxItems":0,"minItems":0,"type":"array"},"input_names":{"items":false,"maxItems":1,"minItems":1,"prefixItems":[{"const":"close","type":"string"}],"type":"array"},"kind":{"const":"FUNCTION","type":"string"},"line_end":{"const":2,"type":"integer"},"line_start":{"const":1,"type":"integer"},"output_names":{"items":false,"maxItems":1,"minItems":1,"prefixItems":[{"const":"return","type":"string"}],"type":"array"},"parameters":{"items":false,"maxItems":1,"minItems":1,"prefixItems":[{"const":"close","type":"string"}],"type":"array"},"qualified_name":{"const":"signal","type":"string"}},"required":["kind","qualified_name","line_start","line_end","parameters","input_names","output_names","dependency_names"],"type":"object"}],"type":"array"}},"required":["ref","request","original_content_ref","original_byte_hash","scan_batch_id","source_metadata_ref","licence_state","classification_tags","primary_category","symbols","findings","duplicates","status"],"type":"object"},"missing":{"items":false,"maxItems":0,"minItems":0,"type":"array"},"next_cursor":{"const":null,"type":"null"},"resource_scope":{"additionalProperties":false,"properties":{"account_id":{"const":null,"type":"null"},"environment":{"const":"LAB","type":"string"},"group_id":{"const":null,"type":"null"},"project_id":{"const":"89d1b768-da99-56e4-96c4-307aa2725fc3","type":"string"}},"required":["project_id","environment","account_id","group_id"],"type":"object"},"schema_version":{"const":"MA-DTO-v6","type":"string"},"snapshot_ref":{"additionalProperties":false,"properties":{"entity_id":{"const":"9efb8614-b29d-5a5f-97bd-af73a16177be","type":"string"},"hash_domain":{"const":"raw-bytes-sha256-v1","type":"string"},"owner":{"const":"PROJECTION_OWNER","type":"string"},"revision_id":{"const":"1c31e833-a16a-5d09-9f52-df85085957f0","type":"string"},"source_hash":{"const":"41378cb6363f7dc566999197e7e7c34b5527297d42fde52d9f1fc456965ab067","type":"string"}},"required":["entity_id","revision_id","owner","hash_domain","source_hash"],"type":"object"}},"required":["schema_version","resource_scope","data","snapshot_ref","as_of","coverage","missing","next_cursor"],"type":"object"}