{"as_of":"2026-10-14T00:00:00Z","coverage":{"completeness":"COMPLETE","covered_window":"FINITE_SOURCE_ROWS","empty_proof_ref":null,"frontier":"C7:1","requested_scope":"getSourceAnalysis","requested_window":"FINITE_SOURCE_ROWS","success":true},"data":{"classification_tags":["AST_ONLY","SIGNAL_RULE","NO_IMPORTS"],"duplicates":[],"findings":[{"line_end":2,"line_start":1,"reason":"Function has only a comparison expression; static AST analysis does not execute it.","rule_id":"C7_AST_NO_IMPORT_CALL","severity":"INFO"}],"licence_state":"KNOWN_ALLOWLISTED","original_byte_hash":"3f3b6b2f39395f0b9e6e00aed9bada7e482d0df6dbdf6cd10d1be1f2becfb2ba","original_content_ref":{"entity_id":"0b834a90-b07d-5f5a-a87b-891eb833d171","hash_domain":"raw-bytes-sha256-v1","owner":"E_RESEARCH","revision_id":"d37dc26a-3c4d-5c26-8491-6673d49dee74","source_hash":"3f3b6b2f39395f0b9e6e00aed9bada7e482d0df6dbdf6cd10d1be1f2becfb2ba"},"primary_category":"SIGNAL_RULE","ref":{"entity_id":"f53e72d3-6ca3-575e-bc38-9fafd530b498","hash_domain":"raw-bytes-sha256-v1","owner":"E_RESEARCH","revision_id":"088d4986-d17b-5f94-ad52-6fd9429c50a3","source_hash":"59afe7227eaf2a2fc21642210ebed0aa073929a256b5ee833d40c9e8be89a5be"},"request":{"comparison_catalog_ref":{"entity_id":"72c5e60c-47d2-51f9-a9a8-900f54136c17","hash_domain":"raw-bytes-sha256-v1","owner":"E_RESEARCH","revision_id":"06b224b7-9af1-58fd-aae0-0ab119310535","source_hash":"630fb812302005599f52a2abba34ac43dcad55b80f53c09cf7f57790e6972718"},"resource_budget_ref":{"entity_id":"e08e9681-0950-563c-81ae-05ce210a213b","hash_domain":"raw-bytes-sha256-v1","owner":"E_RESEARCH","revision_id":"afbcfa75-ef47-56b5-9562-2faa72db3717","source_hash":"7fb1be5d0a1e1d960e72710839ec6002621c88fd76f0d88f94859fc5f8a2897a"},"source_ref":{"entity_id":"77646167-8c99-5a14-b922-1fdde4d9ffb9","hash_domain":"raw-bytes-sha256-v1","owner":"E_RESEARCH","revision_id":"cd278beb-0ce9-5f5c-a7fa-efcd01a5a9cc","source_hash":"5a6fc28a8ad7c74a066c9b57be43e5d2c98f94c6f363cdd17f43cfce6699579a"},"tool_profile_ref":{"entity_id":"fd6bf4e4-6965-551c-adcc-76b135526d36","hash_domain":"raw-bytes-sha256-v1","owner":"E_RESEARCH","revision_id":"28d1665a-3c4c-53d7-9994-9190aca7b400","source_hash":"6627825856533b9634c3c2a5c22d7060d0631c7d2a4482272a17329b713c4847"}},"scan_batch_id":"aae7c2f0-169e-5809-a381-d2f81ea8f1c5","source_metadata_ref":{"entity_id":"d4c6cba4-92a9-5f12-9681-6e5606bd537b","hash_domain":"raw-bytes-sha256-v1","owner":"E_RESEARCH","revision_id":"f5846c54-eb3a-5cc4-a70c-5a7e726ad657","source_hash":"84dabfe33ddbded4ada9e2d2aa5ba908e6276ca24d22c000d915307e2e8d9eb1"},"status":"ANALYZED","symbols":[{"dependency_names":[],"input_names":["close"],"kind":"FUNCTION","line_end":2,"line_start":1,"output_names":["return"],"parameters":["close"],"qualified_name":"signal"}]},"missing":[],"next_cursor":null,"resource_scope":{"account_id":null,"environment":"LAB","group_id":null,"project_id":"89d1b768-da99-56e4-96c4-307aa2725fc3"},"schema_version":"MA-DTO-v6","snapshot_ref":{"entity_id":"9efb8614-b29d-5a5f-97bd-af73a16177be","hash_domain":"raw-bytes-sha256-v1","owner":"PROJECTION_OWNER","revision_id":"1c31e833-a16a-5d09-9f52-df85085957f0","source_hash":"41378cb6363f7dc566999197e7e7c34b5527297d42fde52d9f1fc456965ab067"}}